subject,summary,press,wdate,link
"뉴욕증시, 韓·佛 정국 불안에 경계심 고조…혼조 마감",韓 관련 ETF 급락 후 낙폭 축소 진정호 연합인포맥스 특파원 = 뉴욕증시에서 3대 주가지수는 혼조로 마감했다. 한국과 프랑스에서 정국.. 연합뉴스 | 2024-12-04 06:59:04,연합뉴스,2024-12-04 06:59:04,https://n.news.naver.com/mnews/article/001/0015083111
"""우리만 춥네""…겨울옷 벗고 찬바람 맞은 이 업계",의류주 주가가 겨울바람을 맞았다. 국내 증시 상황이 좋지 않은데다 평년보다 따뜻한 날씨가 이어지며 고마진 상품인 겨울 외투류 판매가 부.. 머니투데이 | 2024-12-04 06:54:00,머니투데이,2024-12-04 06:54:00,https://n.news.naver.com/mnews/article/008/0005123142
S&P500·나스닥 또 최고치…'비상계엄'에 韓기업 주가 하락[뉴욕증시],"미국 뉴욕증시의 3대 지수가 3일(현지시간) 혼조세로 마감했다. 시장이 이날 공개된 고용 지표를 주목하며 숨 고르기에 나선 가운데, S.. 아시아경제 | 2024-12-04 06:52:30",아시아경제,2024-12-04 06:52:30,https://n.news.naver.com/mnews/article/277/0005510706
유증 급증에 엄격해진 금감원…3개월 간 정정 요구 9건 달해,금융감독원이 투자자 보호를 이유로 유상증자 심사 기준을 강화하면서 증권신고서 정정 요구가 급증한 것으로 나타났다. 기업의 자금 조달 창.. 서울경제 | 2024-12-04 06:41:07,서울경제,2024-12-04 06:41:07,https://n.news.naver.com/mnews/article/011/0004422943
국내 증시 부진한데 증권주 잘나가는 이유는,국내 증시의 부진이 지속되고 있지만 증권주들은 줄줄이 신고가를 기록하는 등 주가가 강세를 보이고 있다. 해외주식 투자가 늘면서 국내 증.. 아시아경제 | 2024-12-04 06:40:00,아시아경제,2024-12-04 06:40:00,https://n.news.naver.com/mnews/article/277/0005510704
"거래소, 국내 증시 개장 여부 7시 30분 확정…금융 시장 혼란 이어지나",한국거래소는 4일 국내 증시 개장 여부를 이날 오전 7시 30분에 확정할 계획이라고 밝혔다. 거래소는 기자단에 보낸 문자 공지를 통해 .. 서울경제 | 2024-12-04 06:36:14,서울경제,2024-12-04 06:36:14,https://n.news.naver.com/mnews/article/011/0004422942
"재충전 시간 끝났는데…전력기기株, 다시 달릴까",올해 상반기 증시를 이끌었으나 최근 주춤하는 전력기기 관련주가 다시 주도주로 복귀할 수 있을지 관심이 쏠린다. 증권가는 미국의 전력 인.. 아시아경제 | 2024-12-04 06:30:00,아시아경제,2024-12-04 06:30:00,https://n.news.naver.com/mnews/article/277/0005510703
"""붕어빵 보이니 다시 땡겨""…은행·보험주 사들이는 투자자들, 왜",찬바람이 불면서 은행·보험·증권종목을 사들이는 투자자가 늘었다. 한국은행이 기준금리를 낮춘 여건에서 배당 매력이 부각된 결과로 풀이된다.. 머니투데이 | 2024-12-04 06:23:00,머니투데이,2024-12-04 06:23:00,https://n.news.naver.com/mnews/article/008/0005123134
STO 법안 국회 무관심에 겨울잠 드나…통과 언제쯤,이 기사는 2024년12월04일 04시20분에 마켓인 프리미엄 콘텐츠로 선공개 되었습니다. 토큰증권발행(STO) 법안 발의로 시장이 들.. 이데일리 | 2024-12-04 06:20:19,이데일리,2024-12-04 06:20:19,https://n.news.naver.com/mnews/article/018/0005898387
[속보]뉴욕증시 보합…尹계엄령에 韓주식·펀드 '와르륵',3일(현시시간) 뉴욕3대지수는 보합에 마감했다. 윤석열 대통령의 계엄령 선포에 한국 관련 주식 및 펀드는 급격한 변동성을 보였다. 이날.. 이데일리 | 2024-12-04 06:20:16,이데일리,2024-12-04 06:20:16,https://n.news.naver.com/mnews/article/018/0005898386
계엄령 날벼락에 쿠팡 한때 -9.8% ‘뚝’…美 증시 상장 韓 종목 ‘출렁’ [투자360],미국 뉴욕증시에 상장된 한국 주요 기업의 주가가 윤석열 대통령의 비상계엄 선포로 인해 폭락세를 보였다가 낙폭을 줄이는 모습을 보였다. .. 헤럴드경제 | 2024-12-04 06:18:12,헤럴드경제,2024-12-04 06:18:12,https://n.news.naver.com/mnews/article/016/0002396799
ETF 수장 교체하고 이름 바꾸고…중위권 경쟁 더 치열해진다,ETF(상장지수펀드) 시장 점유율 중위권 자산운용사들이 ETF 관련 조직을 재정비하거나 리브랜딩에 나서는 등 경쟁력 확보에 주력하고 있.. 머니투데이 | 2024-12-04 06:12:00,머니투데이,2024-12-04 06:12:00,https://n.news.naver.com/mnews/article/008/0005123132
금리 인하 수혜주 찾아라...금융·헬스케어 '주목',한국은행이 지난 11월 금융통화위원회에서 시장 예상을 깨고 2연속 금리 인하를 단행하고 국내 투자자들도 수혜주 찾기에 분주하다. 금리 .. 파이낸셜뉴스 | 2024-12-04 06:01:14,파이낸셜뉴스,2024-12-04 06:01:14,https://n.news.naver.com/mnews/article/014/0005276865
'쌍유니콘' 탄생에 SV인베·신한벤처투자 '함박웃음',인공지능(AI) 반도체 스타트업 리벨리온과 커머스 스타트업 에이블리가 잇따라 유니콘(기업가치 1조원 이상 비상장기업)에 등극하면서 이들.. 아시아경제 | 2024-12-04 06:00:00,아시아경제,2024-12-04 06:00:00,https://n.news.naver.com/mnews/article/277/0005510690
"한국거래소 “韓 증시 개장 여부, 오전 7시30분에 결정” [투자360]",“해외상품 거래 동향 살펴 결정하겠다” 코스피200 야간선물옵션·MSCI 한국 ETF 등 급락세 다소 진정 4일 새벽 윤석열 대통령이 .. 헤럴드경제 | 2024-12-04 05:52:18,헤럴드경제,2024-12-04 05:52:18,https://n.news.naver.com/mnews/article/016/0002396789
"하이브, 목표주가 30만→28만-하나","하나증권은 4일 하이브의 목표주가를 30만원에서 28만원으로 낮췄다. 이기훈 연구원은 ""뉴진스 관련 실적을 제외했다""며 ""4월부터 지속.. 파이낸셜뉴스 | 2024-12-04 05:50:14",파이낸셜뉴스,2024-12-04 05:50:14,https://n.news.naver.com/mnews/article/014/0005276859
"""국장은 답이 없다""…곱버스 탄 불개미, 투자 성적은?",국내 증시 약세가 지속되면서 지수 하락에 베팅하는 증권상품들이 높은 수익률을 기록한 것으로 나타났다. 특히 코스닥 지수를 역추종하는 E.. 머니투데이 | 2024-12-04 05:11:00,머니투데이,2024-12-04 05:11:00,https://n.news.naver.com/mnews/article/008/0005123103
한밤 환율·코인·증시 '패닉'…계엄해제 확정에 반등했지만,윤석열 대통령의 비상계엄 선포에 밤새 요동쳤던 금융시장이 윤 대통령의 비상계엄 해제 수용 발언에 반등 조짐을 보이고 있다. 비상계엄 해.. 머니투데이 | 2024-12-04 04:47:44,머니투데이,2024-12-04 04:47:44,https://n.news.naver.com/mnews/article/008/0005123084
"오늘 증시 개장 가능할까?… 거래소 ""상황 살핀 후 아침에 결정""","윤석열 대통령의 비상계엄 선포에 환율, 가상자산 시장 등이 요동치면서 국내 증시는 장 개장 여부도 불투명한 상황이다. 4일 한국거래소 .. 머니S | 2024-12-04 02:39:45",머니S,2024-12-04 02:39:45,https://n.news.naver.com/mnews/article/417/0001042583
‘155분 패닉’ 계엄 선포→해제…롤러코스터 탄 야간선물옵션·韓 ETF(종합),윤석열 대통령이 비상계엄을 선포한 이후 국회가 비상계엄 해제 요구 결의안을 통과시키기까지 155분간 국내 야간선물옵션과 상장지수펀드(E.. 이데일리 | 2024-12-04 02:31:07,이데일리,2024-12-04 02:31:07,https://n.news.naver.com/mnews/article/018/0005898296
'계엄령 선포' 환율·코인·증시 '패닉'…해제 요구 의결에 진정(종합),윤석열 대통령이 3일 밤 비상계엄을 선포하면서 금융·외환시장이 출렁였다. 국회에서 계엄령 선포 2시간 37분 만에 계엄 해제 요구안을 .. 머니S | 2024-12-04 02:28:58,머니S,2024-12-04 02:28:58,https://n.news.naver.com/mnews/article/417/0001042580
‘계엄령 패닉’ 진정세… “외국인 채권 매도 여부가 관건”,국회가 4일 새벽 긴급 본회의를 열고 ‘비상계엄 해제 요구 결의안’을 통과시키면서 금융시장이 소폭 진정세를 보이고 있다. 이날 국내 주.. 조선비즈 | 2024-12-04 02:09:11,조선비즈,2024-12-04 02:09:11,https://n.news.naver.com/mnews/article/366/0001036986
계엄 선포에 환율 뛰고 주식선물 급락…해제 요구 의결에 안정(종합),"원/달러 환율, 2년 1개월 만에 최고치인 1,442.0원까지 급등 주식선물·코인도 급락 후 낙폭 축소 신호경 윤석열 대통령이 지난 3.. 연합뉴스 | 2024-12-04 02:03:01",연합뉴스,2024-12-04 02:03:01,https://n.news.naver.com/mnews/article/001/0015082755
"뉴욕증시, 보합권서 숨 고르기…'비상계엄'에 韓기업 주가 급락",미국 뉴욕증시의 3대 지수가 3일(현지시간) 장 초반 보합권에서 혼조세를 나타내고 있다. 전날 S&P500지수와 나스닥지수가 사상 최고.. 아시아경제 | 2024-12-04 01:55:07,아시아경제,2024-12-04 01:55:07,https://n.news.naver.com/mnews/article/277/0005510607
비상계엄 해제 결의안 가결…야간선물옵션·韓 ETF 등 진정세,국회가 새벽 긴급 본회의를 열고 ‘비상계엄 해제 요구 결의안’을 통과시키면서 급락하던 야간선물옵션지수 등이 진정세를 보이고 있다. 4일.. 데일리안 | 2024-12-04 01:54:11,데일리안,2024-12-04 01:54:11,https://n.news.naver.com/mnews/article/119/0002899857
'비상계엄 해제' 국회 가결에…환율·주가·코인 패닉 진정,김정현 김도엽 강수련 박현영 윤석열 대통령의 비상계엄 해제 요구 결의안이 4일 국회 본회의에서 통과되면서 급등한 환율과 급락한 주가·가.. 뉴스1 | 2024-12-04 01:27:56,뉴스1,2024-12-04 01:27:56,https://n.news.naver.com/mnews/article/421/0007943846
美 상장한 한국 기업 투자 ETF 3%대 하락 [비상계엄],"윤석열 대통령의 비상계엄령 선포 이후, 미국 증시에 상장된 한국물 상장지수펀드(ETF) 등이 하락세를 보이고 있다. 4일 오전 1시 2.. 파이낸셜뉴스 | 2024-12-04 01:27:15",파이낸셜뉴스,2024-12-04 01:27:15,https://n.news.naver.com/mnews/article/014/0005276804
비상계엄 해제안 결의에 국내 증시 야간선물·환율 진정,국회가 비상계엄 해제 요구를 결의하자 국내 야간증시 선물시장과 환율이 비상계엄에 따른 패닉 현상에서 차츰 벗어났다. 국내 야간옵션선물지.. 머니투데이 | 2024-12-04 01:25:40,머니투데이,2024-12-04 01:25:40,https://n.news.naver.com/mnews/article/008/0005123000
"美 증시 상장 한국기업, 계엄령 쇼크에 ‘급락’",윤석열 대통령이 비상계엄을 선포하면서 미국 증시에 상장된 국내 기업들의 주가가 급락하고 있다. 4일 글로벌 외환시장에 따르면 3일 오전.. 데일리안 | 2024-12-04 01:17:09,데일리안,2024-12-04 01:17:09,https://n.news.naver.com/mnews/article/119/0002899849
"뉴욕증시, 한국 비상계엄 선포 충격·관련종목 주가↓…하락 출발",김 현 연합인포맥스 통신원 = 뉴욕증시는 한국 윤석열 정부의 비상계엄 선포에 대해 놀라움과 경계감을 표하며 일제히 하락세로 출발했다. .. 연합뉴스 | 2024-12-04 01:13:09,연합뉴스,2024-12-04 01:13:09,https://n.news.naver.com/mnews/article/001/0015082640
"尹 ""비상계엄"" 기습 선포에…환율 급등·코인 급락·증시 '패닉'(종합2보)",김정현 강수련 김도엽 문혜원 갑작스러운 대통령의 비상계엄 선포에 국내 자산시장도 요동치고 있다. 환율은 1440원을 돌파하고 코스피 선.. 뉴스1 | 2024-12-04 01:09:24,뉴스1,2024-12-04 01:09:24,https://n.news.naver.com/mnews/article/421/0007943803
"'비상계엄' 선포에 증권사도 '충격'… ""코스피 아침까지 지켜봐야""",윤석열 대통령이 비상 계엄령을 선포하는 사상 초유의 사태가 벌어지면서 증권사 리서치센터도 혼란스러운 모습이다. 3일 한국거래소에 따르면.. 머니S | 2024-12-04 00:47:58,머니S,2024-12-04 00:47:58,https://n.news.naver.com/mnews/article/417/0001042546
"금융시장 대혼란…환율 급등, 코리아ETF 급락",윤석열 대통령이 3일 비상계엄을 선포하면서 4일 금융시장은 대혼란을 겪을 것으로 예상된다. 이날 계엄령 선포 직후 야간 파생상품 시장은.. 한국경제 | 2024-12-04 00:40:23,한국경제,2024-12-04 00:40:23,https://n.news.naver.com/mnews/article/015/0005065072
비상계엄에 코스피 야간 선물옵션 급락… 美 상장 한국 주식도 하락세,윤석열 대통령이 3일 밤 비상계엄을 선포하면서 국내 증시 야간선물옵션 지수가 급락세를 보이고 있다. 4일 오전 12시 19분 현재 코스.. 조선비즈 | 2024-12-04 00:30:12,조선비즈,2024-12-04 00:30:12,https://n.news.naver.com/mnews/article/366/0001036952
"'계엄 선포'에 환율 뛰고 주식·코인 급락…""증시 개장 미정""","환율, 야간거래 중 2년 1개월 최고수준인 1,441.0원까지 치솟아 신호경 윤석열 대통령이 3일 밤 비상 계엄을 선포하면서 원/달러 .. 연합뉴스 | 2024-12-04 00:26:00",연합뉴스,2024-12-04 00:26:00,https://n.news.naver.com/mnews/article/001/0015082552
비상계엄 선포 여파로 해외 비트코인도 추락… 리플 5%↓,윤석열 대통령이 간밤 용산 대통령실에서 긴급 대국민 특별담화를 갖고 비상계엄을 선포하면서 해외 거래소 기준 비트코인 가격도 하락세다. .. 머니S | 2024-12-04 00:18:37,머니S,2024-12-04 00:18:37,https://n.news.naver.com/mnews/article/417/0001042531
계엄선포에 코인·증시 급락… 투자자 한밤 중 '패닉',윤석열 대통령이 비상 계엄령을 선포하는 사상 초유의 사태가 벌어지면서 증시 안팎이 불확실성으로 들썩이고 있다. 투자자들도 간밤 3일 한.. 머니S | 2024-12-04 00:03:41,머니S,2024-12-04 00:03:41,https://n.news.naver.com/mnews/article/417/0001042525
"""증시엔 'IMF급 악재'""…4일 금융시장 대혼란 예고",윤석열 대통령이 3일 비상계엄을 선포하면서 4일 금융시장은 대혼란을 겪을 것으로 예상된다. 이날 계엄령 선포 직후 야간 파생상품 시장은.. 한국경제 | 2024-12-04 00:02:20,한국경제,2024-12-04 00:02:20,https://n.news.naver.com/mnews/article/015/0005065038
